{
  "accounts": [
    "235509:80D599720",
    "35520:80D597F50"
  ],
  "case_id": "FG-39c67d92",
  "coverage": {
    "demonstrated_rails": [
      "ACH"
    ],
    "rails": {
      "ACH": 1
    },
    "unknown_rail_transactions": 0,
    "warning": null
  },
  "created_at": "2026-09-21T13:27:56.505603+00:00",
  "disposition": null,
  "investigator_notes": [],
  "model": {
    "feature_schema_hash": "ca7efed40f449a71",
    "git_commit": "d230c50ef73e93e3d48cf20e5d30f1d8fcbdc1f4",
    "model_id": "flowguard_A4_v1",
    "uses_payment_type": false
  },
  "path": [
    {
      "amount": 10895.72,
      "at": "2022-09-09T04:43:00+00:00",
      "depth": 1,
      "from": "35520:80D597F50",
      "payment_type": "ACH",
      "to": "235509:80D599720",
      "transaction_id": "TX0004361127"
    }
  ],
  "reasons": [
    {
      "code": "GFP_F207_RAISED",
      "contribution": 1.5525496006011963,
      "feature": "gfp_f207",
      "opaque": true,
      "transaction_ids": [
        "TX0004361127"
      ]
    },
    {
      "code": "GFP_F185_RAISED",
      "contribution": 1.077250599861145,
      "feature": "gfp_f185",
      "opaque": true,
      "transaction_ids": [
        "TX0004361127"
      ]
    },
    {
      "code": "TX_AMOUNT_RAISED",
      "contribution": 0.3673728406429291,
      "feature": "tx_amount",
      "opaque": false,
      "transaction_ids": [
        "TX0004361127"
      ]
    },
    {
      "code": "GFP_F183_LOWERED",
      "contribution": -0.3454611599445343,
      "feature": "gfp_f183",
      "opaque": true,
      "transaction_ids": [
        "TX0004361127"
      ]
    },
    {
      "code": "GFP_F190_LOWERED",
      "contribution": -0.27482250332832336,
      "feature": "gfp_f190",
      "opaque": true,
      "transaction_ids": [
        "TX0004361127"
      ]
    },
    {
      "code": "GFP_F195_LOWERED",
      "contribution": -0.21162940561771393,
      "feature": "gfp_f195",
      "opaque": true,
      "transaction_ids": [
        "TX0004361127"
      ]
    },
    {
      "code": "GFP_F187_LOWERED",
      "contribution": -0.21110595762729645,
      "feature": "gfp_f187",
      "opaque": true,
      "transaction_ids": [
        "TX0004361127"
      ]
    },
    {
      "code": "TX_AMOUNT_RECEIVED_LOG_RAISED",
      "contribution": 0.1967019885778427,
      "feature": "tx_amount_received_log",
      "opaque": false,
      "transaction_ids": [
        "TX0004361127"
      ]
    }
  ],
  "risk": {
    "above_threshold": true,
    "score": 0.06499999761581421,
    "threshold": 0.009264620952308178,
    "threshold_source": "validation @ 1.0% alert budget"
  },
  "schema_version": "1.0",
  "subject_account": "35520:80D597F50",
  "trace": {
    "direction": "forward",
    "horizon": 3,
    "is_complete": true,
    "per_hop": [
      {
        "amount": 10895.72,
        "depth": 1,
        "n_accounts": 1,
        "n_transactions": 1
      }
    ],
    "root": "35520:80D597F50",
    "terminals": [
      "235509:80D599720"
    ],
    "truncation": {
      "budget_exhausted": false,
      "capped_vertices": 0,
      "degree_cap": 16,
      "edge_budget": 200,
      "reason": null
    }
  },
  "transaction_ids": [
    "TX0004361127"
  ]
}