{
  "accounts": [
    "10344:808D193A0",
    "130637:80FEAF310",
    "135981:80F984C70",
    "16788:80E0B64B0",
    "219860:80B5B33D0",
    "236346:80E4A4620",
    "28693:80DC84FA0",
    "48526:812411030"
  ],
  "case_id": "FG-6fef29de",
  "coverage": {
    "demonstrated_rails": [
      "ACH"
    ],
    "rails": {
      "ACH": 7,
      "Cheque": 2,
      "Credit Card": 1
    },
    "unknown_rail_transactions": 0,
    "warning": "This case involves payment rails on which the model has NOT demonstrated recall. On the validation corpus it caught 599 of 796 ACH laundering transactions and 1 of 100 across all other rails combined (ADR-007). Absence of an alert on these transactions is not evidence of absence."
  },
  "created_at": "2026-09-26T10:04:36.101808+00:00",
  "disposition": null,
  "investigator_notes": [],
  "model": {
    "feature_schema_hash": "7c58a20d069f9985",
    "git_commit": "d59a1254c41d203119f7264c1d16015c95a84b4c",
    "model_id": "flowguard_V2_v1",
    "uses_payment_type": false
  },
  "path": [
    {
      "amount": 15020.35,
      "at": "2022-09-08T17:18:00+00:00",
      "depth": 1,
      "from": "135981:80F984C70",
      "payment_type": "ACH",
      "to": "10344:808D193A0",
      "transaction_id": "TX0000812705"
    },
    {
      "amount": 16239.6,
      "at": "2022-09-08T19:55:00+00:00",
      "depth": 1,
      "from": "135981:80F984C70",
      "payment_type": "ACH",
      "to": "236346:80E4A4620",
      "transaction_id": "TX0000812706"
    },
    {
      "amount": 12838.76,
      "at": "2022-09-08T23:01:00+00:00",
      "depth": 1,
      "from": "135981:80F984C70",
      "payment_type": "ACH",
      "to": "28693:80DC84FA0",
      "transaction_id": "TX0000812707"
    },
    {
      "amount": 478.17,
      "at": "2022-09-09T04:58:00+00:00",
      "depth": 1,
      "from": "135981:80F984C70",
      "payment_type": "ACH",
      "to": "135981:80F984C70",
      "transaction_id": "TX0000812708"
    },
    {
      "amount": 1793.65,
      "at": "2022-09-09T04:58:00+00:00",
      "depth": 1,
      "from": "135981:80F984C70",
      "payment_type": "ACH",
      "to": "48526:812411030",
      "transaction_id": "TX0000812709"
    },
    {
      "amount": 7136.67,
      "at": "2022-09-09T08:29:00+00:00",
      "depth": 1,
      "from": "135981:80F984C70",
      "payment_type": "ACH",
      "to": "219860:80B5B33D0",
      "transaction_id": "TX0000812710"
    },
    {
      "amount": 1294.05,
      "at": "2022-09-09T00:20:00+00:00",
      "depth": 2,
      "from": "10344:808D193A0",
      "payment_type": "Credit Card",
      "to": "130637:80FEAF310",
      "transaction_id": "TX0004223552"
    },
    {
      "amount": 961.04,
      "at": "2022-09-09T00:25:00+00:00",
      "depth": 2,
      "from": "10344:808D193A0",
      "payment_type": "Cheque",
      "to": "130637:80FEAF310",
      "transaction_id": "TX0004223551"
    },
    {
      "amount": 5360.95,
      "at": "2022-09-09T08:18:00+00:00",
      "depth": 2,
      "from": "28693:80DC84FA0",
      "payment_type": "ACH",
      "to": "16788:80E0B64B0",
      "transaction_id": "TX0004446870"
    },
    {
      "amount": 13140.43,
      "at": "2022-09-09T08:25:00+00:00",
      "depth": 2,
      "from": "28693:80DC84FA0",
      "payment_type": "Cheque",
      "to": "16788:80E0B64B0",
      "transaction_id": "TX0004446869"
    }
  ],
  "reasons": [
    {
      "code": "GFP_F185_RAISED",
      "contribution": 9.03480339050293,
      "feature": "gfp_f185",
      "label": "sender's outgoing transfers (24h window): fan/degree ratio (GFP 'ratio')",
      "opaque": false,
      "transaction_ids": [
        "TX0000812705",
        "TX0000812707",
        "TX0000812710",
        "TX0000812706",
        "TX0000812709"
      ]
    },
    {
      "code": "GFP_F197_RAISED",
      "contribution": 7.99938440322876,
      "feature": "gfp_f197",
      "label": "sender's incoming transfers (24h window): transaction count",
      "opaque": false,
      "transaction_ids": [
        "TX0000812706",
        "TX0000812710",
        "TX0000812709",
        "TX0000812705",
        "TX0000812707",
        "TX0004223551",
        "TX0004446870",
        "TX0004223552",
        "TX0004446869",
        "TX0000812708"
      ]
    },
    {
      "code": "BH_PAIR_N_PRIOR_LOWERED",
      "contribution": -6.187189102172852,
      "feature": "bh_pair_n_prior",
      "label": "earlier transfers from this sender to this receiver (0 = first-time counterparty)",
      "opaque": false,
      "transaction_ids": [
        "TX0004446870",
        "TX0004446869",
        "TX0004223552",
        "TX0004223551",
        "TX0000812708"
      ]
    },
    {
      "code": "GFP_F183_RAISED",
      "contribution": 3.6714887619018555,
      "feature": "gfp_f183",
      "label": "sender's outgoing transfers (24h window): distinct counterparties",
      "opaque": false,
      "transaction_ids": [
        "TX0000812706",
        "TX0000812710",
        "TX0000812709",
        "TX0000812707",
        "TX0000812705"
      ]
    },
    {
      "code": "BH_SRC_OUT_N_24H_RAISED",
      "contribution": 3.329770088195801,
      "feature": "bh_src_out_n_24h",
      "label": "transfers the sender made in the previous 24h",
      "opaque": false,
      "transaction_ids": [
        "TX0000812705",
        "TX0000812709",
        "TX0000812706",
        "TX0000812710",
        "TX0000812707",
        "TX0000812708"
      ]
    },
    {
      "code": "GFP_F223_RAISED",
      "contribution": 3.1820404529571533,
      "feature": "gfp_f223",
      "label": "receiver's incoming transfers (24h window): transaction count",
      "opaque": false,
      "transaction_ids": [
        "TX0000812705",
        "TX0000812707",
        "TX0004223552",
        "TX0004223551",
        "TX0004446869",
        "TX0004446870"
      ]
    },
    {
      "code": "GFP_F196_RAISED",
      "contribution": 3.116799831390381,
      "feature": "gfp_f196",
      "label": "sender's incoming transfers (24h window): distinct counterparties",
      "opaque": false,
      "transaction_ids": [
        "TX0000812710",
        "TX0000812709",
        "TX0000812706",
        "TX0000812705",
        "TX0000812707",
        "TX0004446869",
        "TX0004446870",
        "TX0000812708"
      ]
    },
    {
      "code": "BH_DST_IN_N_24H_RAISED",
      "contribution": 1.5795263051986694,
      "feature": "bh_dst_in_n_24h",
      "label": "transfers the receiver received in the previous 24h",
      "opaque": false,
      "transaction_ids": [
        "TX0000812705",
        "TX0000812706",
        "TX0000812710",
        "TX0000812707",
        "TX0004446870",
        "TX0000812708"
      ]
    }
  ],
  "risk": {
    "above_threshold": true,
    "score": 1.0,
    "threshold": 0.01364365965127945,
    "threshold_source": "validation @ 1.0% alert budget"
  },
  "schema_version": "1.0",
  "subject_account": "135981:80F984C70",
  "trace": {
    "direction": "forward",
    "horizon": 3,
    "is_complete": true,
    "per_hop": [
      {
        "amount": 53507.2,
        "depth": 1,
        "n_accounts": 6,
        "n_transactions": 6
      },
      {
        "amount": 20756.47,
        "depth": 2,
        "n_accounts": 2,
        "n_transactions": 4
      }
    ],
    "root": "135981:80F984C70",
    "terminals": [
      "130637:80FEAF310",
      "16788:80E0B64B0",
      "219860:80B5B33D0",
      "236346:80E4A4620",
      "48526:812411030"
    ],
    "truncation": {
      "budget_exhausted": false,
      "capped_vertices": 0,
      "degree_cap": 16,
      "edge_budget": 200,
      "reason": null
    }
  },
  "transaction_ids": [
    "TX0000812705",
    "TX0000812706",
    "TX0000812707",
    "TX0000812708",
    "TX0000812709",
    "TX0000812710",
    "TX0004223552",
    "TX0004223551",
    "TX0004446870",
    "TX0004446869"
  ]
}