{
  "accounts": [
    "18902:803F00790",
    "6156:803F11650"
  ],
  "case_id": "FG-c971aac1",
  "coverage": {
    "demonstrated_rails": [
      "ACH"
    ],
    "rails": {
      "ACH": 1
    },
    "unknown_rail_transactions": 0,
    "warning": null
  },
  "created_at": "2026-09-21T13:27:56.018467+00:00",
  "disposition": null,
  "investigator_notes": [],
  "model": {
    "feature_schema_hash": "ca7efed40f449a71",
    "git_commit": "d230c50ef73e93e3d48cf20e5d30f1d8fcbdc1f4",
    "model_id": "flowguard_A4_v1",
    "uses_payment_type": false
  },
  "path": [
    {
      "amount": 38538.35,
      "at": "2022-09-09T04:21:00+00:00",
      "depth": 1,
      "from": "6156:803F11650",
      "payment_type": "ACH",
      "to": "18902:803F00790",
      "transaction_id": "TX0004337665"
    }
  ],
  "reasons": [
    {
      "code": "GFP_F207_RAISED",
      "contribution": 1.5568335056304932,
      "feature": "gfp_f207",
      "opaque": true,
      "transaction_ids": [
        "TX0004337665"
      ]
    },
    {
      "code": "GFP_F185_RAISED",
      "contribution": 1.092352271080017,
      "feature": "gfp_f185",
      "opaque": true,
      "transaction_ids": [
        "TX0004337665"
      ]
    },
    {
      "code": "GFP_F183_LOWERED",
      "contribution": -0.3474600613117218,
      "feature": "gfp_f183",
      "opaque": true,
      "transaction_ids": [
        "TX0004337665"
      ]
    },
    {
      "code": "GFP_F190_LOWERED",
      "contribution": -0.30779537558555603,
      "feature": "gfp_f190",
      "opaque": true,
      "transaction_ids": [
        "TX0004337665"
      ]
    },
    {
      "code": "GFP_F188_LOWERED",
      "contribution": -0.19169092178344727,
      "feature": "gfp_f188",
      "opaque": true,
      "transaction_ids": [
        "TX0004337665"
      ]
    },
    {
      "code": "GFP_F202_RAISED",
      "contribution": 0.18491464853286743,
      "feature": "gfp_f202",
      "opaque": true,
      "transaction_ids": [
        "TX0004337665"
      ]
    },
    {
      "code": "GFP_F211_RAISED",
      "contribution": 0.16798798739910126,
      "feature": "gfp_f211",
      "opaque": true,
      "transaction_ids": [
        "TX0004337665"
      ]
    },
    {
      "code": "TX_AMOUNT_RAISED",
      "contribution": 0.15053622424602509,
      "feature": "tx_amount",
      "opaque": false,
      "transaction_ids": [
        "TX0004337665"
      ]
    }
  ],
  "risk": {
    "above_threshold": true,
    "score": 0.06578947603702545,
    "threshold": 0.009264620952308178,
    "threshold_source": "validation @ 1.0% alert budget"
  },
  "schema_version": "1.0",
  "subject_account": "6156:803F11650",
  "trace": {
    "direction": "forward",
    "horizon": 3,
    "is_complete": true,
    "per_hop": [
      {
        "amount": 38538.35,
        "depth": 1,
        "n_accounts": 1,
        "n_transactions": 1
      }
    ],
    "root": "6156:803F11650",
    "terminals": [
      "18902:803F00790"
    ],
    "truncation": {
      "budget_exhausted": false,
      "capped_vertices": 0,
      "degree_cap": 16,
      "edge_budget": 200,
      "reason": null
    }
  },
  "transaction_ids": [
    "TX0004337665"
  ]
}