{
  "accounts": [
    "250068:8128384D0",
    "50202:812832010"
  ],
  "case_id": "FG-59aedba7",
  "coverage": {
    "demonstrated_rails": [
      "ACH"
    ],
    "rails": {
      "ACH": 1
    },
    "unknown_rail_transactions": 0,
    "warning": null
  },
  "created_at": "2026-09-21T13:27:57.880807+00:00",
  "disposition": null,
  "investigator_notes": [],
  "model": {
    "feature_schema_hash": "ca7efed40f449a71",
    "git_commit": "d230c50ef73e93e3d48cf20e5d30f1d8fcbdc1f4",
    "model_id": "flowguard_A4_v1",
    "uses_payment_type": false
  },
  "path": [
    {
      "amount": 6457.61,
      "at": "2022-09-09T04:13:00+00:00",
      "depth": 1,
      "from": "250068:8128384D0",
      "payment_type": "ACH",
      "to": "50202:812832010",
      "transaction_id": "TX0004349292"
    }
  ],
  "reasons": [
    {
      "code": "GFP_F207_RAISED",
      "contribution": 1.599765658378601,
      "feature": "gfp_f207",
      "opaque": true,
      "transaction_ids": [
        "TX0004349292"
      ]
    },
    {
      "code": "GFP_F185_RAISED",
      "contribution": 1.0907366275787354,
      "feature": "gfp_f185",
      "opaque": true,
      "transaction_ids": [
        "TX0004349292"
      ]
    },
    {
      "code": "GFP_F183_LOWERED",
      "contribution": -0.3460562527179718,
      "feature": "gfp_f183",
      "opaque": true,
      "transaction_ids": [
        "TX0004349292"
      ]
    },
    {
      "code": "GFP_F187_LOWERED",
      "contribution": -0.3062407672405243,
      "feature": "gfp_f187",
      "opaque": true,
      "transaction_ids": [
        "TX0004349292"
      ]
    },
    {
      "code": "GFP_F190_LOWERED",
      "contribution": -0.30237534642219543,
      "feature": "gfp_f190",
      "opaque": true,
      "transaction_ids": [
        "TX0004349292"
      ]
    },
    {
      "code": "TX_AMOUNT_RAISED",
      "contribution": 0.2657710909843445,
      "feature": "tx_amount",
      "opaque": false,
      "transaction_ids": [
        "TX0004349292"
      ]
    },
    {
      "code": "GFP_F202_RAISED",
      "contribution": 0.26183611154556274,
      "feature": "gfp_f202",
      "opaque": true,
      "transaction_ids": [
        "TX0004349292"
      ]
    },
    {
      "code": "GFP_F212_LOWERED",
      "contribution": -0.25523772835731506,
      "feature": "gfp_f212",
      "opaque": true,
      "transaction_ids": [
        "TX0004349292"
      ]
    }
  ],
  "risk": {
    "above_threshold": true,
    "score": 0.03999999910593033,
    "threshold": 0.009264620952308178,
    "threshold_source": "validation @ 1.0% alert budget"
  },
  "schema_version": "1.0",
  "subject_account": "250068:8128384D0",
  "trace": {
    "direction": "forward",
    "horizon": 3,
    "is_complete": true,
    "per_hop": [
      {
        "amount": 6457.61,
        "depth": 1,
        "n_accounts": 1,
        "n_transactions": 1
      }
    ],
    "root": "250068:8128384D0",
    "terminals": [
      "50202:812832010"
    ],
    "truncation": {
      "budget_exhausted": false,
      "capped_vertices": 0,
      "degree_cap": 16,
      "edge_budget": 200,
      "reason": null
    }
  },
  "transaction_ids": [
    "TX0004349292"
  ]
}