{
  "accounts": [
    "148350:811E8B180",
    "248857:811EE01A0"
  ],
  "case_id": "FG-a4955b4e",
  "coverage": {
    "demonstrated_rails": [
      "ACH"
    ],
    "rails": {
      "ACH": 1
    },
    "unknown_rail_transactions": 0,
    "warning": null
  },
  "created_at": "2026-09-21T13:27:57.503475+00:00",
  "disposition": null,
  "investigator_notes": [],
  "model": {
    "feature_schema_hash": "ca7efed40f449a71",
    "git_commit": "d230c50ef73e93e3d48cf20e5d30f1d8fcbdc1f4",
    "model_id": "flowguard_A4_v1",
    "uses_payment_type": false
  },
  "path": [
    {
      "amount": 1397.49,
      "at": "2022-09-09T03:22:00+00:00",
      "depth": 1,
      "from": "148350:811E8B180",
      "payment_type": "ACH",
      "to": "248857:811EE01A0",
      "transaction_id": "TX0004322752"
    }
  ],
  "reasons": [
    {
      "code": "GFP_F207_RAISED",
      "contribution": 1.5146574974060059,
      "feature": "gfp_f207",
      "opaque": true,
      "transaction_ids": [
        "TX0004322752"
      ]
    },
    {
      "code": "GFP_F185_RAISED",
      "contribution": 1.151097297668457,
      "feature": "gfp_f185",
      "opaque": true,
      "transaction_ids": [
        "TX0004322752"
      ]
    },
    {
      "code": "GFP_F183_LOWERED",
      "contribution": -0.32674333453178406,
      "feature": "gfp_f183",
      "opaque": true,
      "transaction_ids": [
        "TX0004322752"
      ]
    },
    {
      "code": "GFP_F187_LOWERED",
      "contribution": -0.32125282287597656,
      "feature": "gfp_f187",
      "opaque": true,
      "transaction_ids": [
        "TX0004322752"
      ]
    },
    {
      "code": "TX_MINUTE_OF_DAY_LOWERED",
      "contribution": -0.31491944193840027,
      "feature": "tx_minute_of_day",
      "opaque": false,
      "transaction_ids": [
        "TX0004322752"
      ]
    },
    {
      "code": "GFP_F194_LOWERED",
      "contribution": -0.307921826839447,
      "feature": "gfp_f194",
      "opaque": true,
      "transaction_ids": [
        "TX0004322752"
      ]
    },
    {
      "code": "GFP_F202_RAISED",
      "contribution": 0.2593936324119568,
      "feature": "gfp_f202",
      "opaque": true,
      "transaction_ids": [
        "TX0004322752"
      ]
    },
    {
      "code": "GFP_F190_LOWERED",
      "contribution": -0.225722998380661,
      "feature": "gfp_f190",
      "opaque": true,
      "transaction_ids": [
        "TX0004322752"
      ]
    }
  ],
  "risk": {
    "above_threshold": true,
    "score": 0.04545454680919647,
    "threshold": 0.009264620952308178,
    "threshold_source": "validation @ 1.0% alert budget"
  },
  "schema_version": "1.0",
  "subject_account": "148350:811E8B180",
  "trace": {
    "direction": "forward",
    "horizon": 3,
    "is_complete": true,
    "per_hop": [
      {
        "amount": 1397.49,
        "depth": 1,
        "n_accounts": 1,
        "n_transactions": 1
      }
    ],
    "root": "148350:811E8B180",
    "terminals": [
      "248857:811EE01A0"
    ],
    "truncation": {
      "budget_exhausted": false,
      "capped_vertices": 0,
      "degree_cap": 16,
      "edge_budget": 200,
      "reason": null
    }
  },
  "transaction_ids": [
    "TX0004322752"
  ]
}