{
  "accounts": [
    "112064:804AD4F00",
    "112497:804AD49C0"
  ],
  "case_id": "FG-a0e9b30d",
  "coverage": {
    "demonstrated_rails": [
      "ACH"
    ],
    "rails": {
      "ACH": 1
    },
    "unknown_rail_transactions": 0,
    "warning": null
  },
  "created_at": "2026-09-21T13:27:57.151083+00:00",
  "disposition": null,
  "investigator_notes": [],
  "model": {
    "feature_schema_hash": "ca7efed40f449a71",
    "git_commit": "d230c50ef73e93e3d48cf20e5d30f1d8fcbdc1f4",
    "model_id": "flowguard_A4_v1",
    "uses_payment_type": false
  },
  "path": [
    {
      "amount": 76397.72,
      "at": "2022-09-09T05:07:00+00:00",
      "depth": 1,
      "from": "112497:804AD49C0",
      "payment_type": "ACH",
      "to": "112064:804AD4F00",
      "transaction_id": "TX0004372191"
    }
  ],
  "reasons": [
    {
      "code": "GFP_F207_RAISED",
      "contribution": 1.5580371618270874,
      "feature": "gfp_f207",
      "opaque": true,
      "transaction_ids": [
        "TX0004372191"
      ]
    },
    {
      "code": "GFP_F185_RAISED",
      "contribution": 1.1613222360610962,
      "feature": "gfp_f185",
      "opaque": true,
      "transaction_ids": [
        "TX0004372191"
      ]
    },
    {
      "code": "GFP_F183_LOWERED",
      "contribution": -0.3475566506385803,
      "feature": "gfp_f183",
      "opaque": true,
      "transaction_ids": [
        "TX0004372191"
      ]
    },
    {
      "code": "GFP_F190_LOWERED",
      "contribution": -0.2661018371582031,
      "feature": "gfp_f190",
      "opaque": true,
      "transaction_ids": [
        "TX0004372191"
      ]
    },
    {
      "code": "GFP_F184_RAISED",
      "contribution": 0.18707172572612762,
      "feature": "gfp_f184",
      "opaque": true,
      "transaction_ids": [
        "TX0004372191"
      ]
    },
    {
      "code": "GFP_F188_LOWERED",
      "contribution": -0.18011265993118286,
      "feature": "gfp_f188",
      "opaque": true,
      "transaction_ids": [
        "TX0004372191"
      ]
    },
    {
      "code": "GFP_F194_LOWERED",
      "contribution": -0.15897852182388306,
      "feature": "gfp_f194",
      "opaque": true,
      "transaction_ids": [
        "TX0004372191"
      ]
    },
    {
      "code": "GFP_F202_RAISED",
      "contribution": 0.15267960727214813,
      "feature": "gfp_f202",
      "opaque": true,
      "transaction_ids": [
        "TX0004372191"
      ]
    }
  ],
  "risk": {
    "above_threshold": true,
    "score": 0.04545454680919647,
    "threshold": 0.009264620952308178,
    "threshold_source": "validation @ 1.0% alert budget"
  },
  "schema_version": "1.0",
  "subject_account": "112497:804AD49C0",
  "trace": {
    "direction": "forward",
    "horizon": 3,
    "is_complete": true,
    "per_hop": [
      {
        "amount": 76397.72,
        "depth": 1,
        "n_accounts": 1,
        "n_transactions": 1
      }
    ],
    "root": "112497:804AD49C0",
    "terminals": [
      "112064:804AD4F00"
    ],
    "truncation": {
      "budget_exhausted": false,
      "capped_vertices": 0,
      "degree_cap": 16,
      "edge_budget": 200,
      "reason": null
    }
  },
  "transaction_ids": [
    "TX0004372191"
  ]
}