{
  "accounts": [
    "143242:810627700",
    "220:8106323D0"
  ],
  "case_id": "FG-9ab632d5",
  "coverage": {
    "demonstrated_rails": [
      "ACH"
    ],
    "rails": {
      "ACH": 1
    },
    "unknown_rail_transactions": 0,
    "warning": null
  },
  "created_at": "2026-09-21T13:27:56.707705+00:00",
  "disposition": null,
  "investigator_notes": [],
  "model": {
    "feature_schema_hash": "ca7efed40f449a71",
    "git_commit": "d230c50ef73e93e3d48cf20e5d30f1d8fcbdc1f4",
    "model_id": "flowguard_A4_v1",
    "uses_payment_type": false
  },
  "path": [
    {
      "amount": 8513.62,
      "at": "2022-09-09T04:36:00+00:00",
      "depth": 1,
      "from": "143242:810627700",
      "payment_type": "ACH",
      "to": "220:8106323D0",
      "transaction_id": "TX0004362154"
    }
  ],
  "reasons": [
    {
      "code": "GFP_F207_RAISED",
      "contribution": 1.4949383735656738,
      "feature": "gfp_f207",
      "opaque": true,
      "transaction_ids": [
        "TX0004362154"
      ]
    },
    {
      "code": "GFP_F185_RAISED",
      "contribution": 1.1389509439468384,
      "feature": "gfp_f185",
      "opaque": true,
      "transaction_ids": [
        "TX0004362154"
      ]
    },
    {
      "code": "GFP_F183_LOWERED",
      "contribution": -0.3463907241821289,
      "feature": "gfp_f183",
      "opaque": true,
      "transaction_ids": [
        "TX0004362154"
      ]
    },
    {
      "code": "GFP_F195_LOWERED",
      "contribution": -0.31624165177345276,
      "feature": "gfp_f195",
      "opaque": true,
      "transaction_ids": [
        "TX0004362154"
      ]
    },
    {
      "code": "GFP_F194_LOWERED",
      "contribution": -0.28517696261405945,
      "feature": "gfp_f194",
      "opaque": true,
      "transaction_ids": [
        "TX0004362154"
      ]
    },
    {
      "code": "GFP_F187_LOWERED",
      "contribution": -0.2646882236003876,
      "feature": "gfp_f187",
      "opaque": true,
      "transaction_ids": [
        "TX0004362154"
      ]
    },
    {
      "code": "TX_AMOUNT_RAISED",
      "contribution": 0.23955239355564117,
      "feature": "tx_amount",
      "opaque": false,
      "transaction_ids": [
        "TX0004362154"
      ]
    },
    {
      "code": "GFP_F190_LOWERED",
      "contribution": -0.23465591669082642,
      "feature": "gfp_f190",
      "opaque": true,
      "transaction_ids": [
        "TX0004362154"
      ]
    }
  ],
  "risk": {
    "above_threshold": true,
    "score": 0.054999999701976776,
    "threshold": 0.009264620952308178,
    "threshold_source": "validation @ 1.0% alert budget"
  },
  "schema_version": "1.0",
  "subject_account": "143242:810627700",
  "trace": {
    "direction": "forward",
    "horizon": 3,
    "is_complete": true,
    "per_hop": [
      {
        "amount": 8513.62,
        "depth": 1,
        "n_accounts": 1,
        "n_transactions": 1
      }
    ],
    "root": "143242:810627700",
    "terminals": [
      "220:8106323D0"
    ],
    "truncation": {
      "budget_exhausted": false,
      "capped_vertices": 0,
      "degree_cap": 16,
      "edge_budget": 200,
      "reason": null
    }
  },
  "transaction_ids": [
    "TX0004362154"
  ]
}