{
  "accounts": [
    "10614:803F0E970",
    "18902:803F00790"
  ],
  "case_id": "FG-8aa3bfef",
  "coverage": {
    "demonstrated_rails": [
      "ACH"
    ],
    "rails": {
      "ACH": 1
    },
    "unknown_rail_transactions": 0,
    "warning": null
  },
  "created_at": "2026-09-21T13:27:57.689833+00:00",
  "disposition": null,
  "investigator_notes": [],
  "model": {
    "feature_schema_hash": "ca7efed40f449a71",
    "git_commit": "d230c50ef73e93e3d48cf20e5d30f1d8fcbdc1f4",
    "model_id": "flowguard_A4_v1",
    "uses_payment_type": false
  },
  "path": [
    {
      "amount": 42316.36,
      "at": "2022-09-09T04:27:00+00:00",
      "depth": 1,
      "from": "10614:803F0E970",
      "payment_type": "ACH",
      "to": "18902:803F00790",
      "transaction_id": "TX0004337676"
    }
  ],
  "reasons": [
    {
      "code": "GFP_F207_RAISED",
      "contribution": 1.5928118228912354,
      "feature": "gfp_f207",
      "opaque": true,
      "transaction_ids": [
        "TX0004337676"
      ]
    },
    {
      "code": "GFP_F185_RAISED",
      "contribution": 1.106147289276123,
      "feature": "gfp_f185",
      "opaque": true,
      "transaction_ids": [
        "TX0004337676"
      ]
    },
    {
      "code": "GFP_F183_LOWERED",
      "contribution": -0.3779374659061432,
      "feature": "gfp_f183",
      "opaque": true,
      "transaction_ids": [
        "TX0004337676"
      ]
    },
    {
      "code": "GFP_F190_LOWERED",
      "contribution": -0.30652230978012085,
      "feature": "gfp_f190",
      "opaque": true,
      "transaction_ids": [
        "TX0004337676"
      ]
    },
    {
      "code": "GFP_F202_RAISED",
      "contribution": 0.2137538492679596,
      "feature": "gfp_f202",
      "opaque": true,
      "transaction_ids": [
        "TX0004337676"
      ]
    },
    {
      "code": "GFP_F214_RAISED",
      "contribution": 0.1917887181043625,
      "feature": "gfp_f214",
      "opaque": true,
      "transaction_ids": [
        "TX0004337676"
      ]
    },
    {
      "code": "GFP_F213_LOWERED",
      "contribution": -0.18703527748584747,
      "feature": "gfp_f213",
      "opaque": true,
      "transaction_ids": [
        "TX0004337676"
      ]
    },
    {
      "code": "GFP_F079_LOWERED",
      "contribution": -0.16635873913764954,
      "feature": "gfp_f079",
      "opaque": true,
      "transaction_ids": [
        "TX0004337676"
      ]
    }
  ],
  "risk": {
    "above_threshold": true,
    "score": 0.043478261679410934,
    "threshold": 0.009264620952308178,
    "threshold_source": "validation @ 1.0% alert budget"
  },
  "schema_version": "1.0",
  "subject_account": "10614:803F0E970",
  "trace": {
    "direction": "forward",
    "horizon": 3,
    "is_complete": true,
    "per_hop": [
      {
        "amount": 42316.36,
        "depth": 1,
        "n_accounts": 1,
        "n_transactions": 1
      }
    ],
    "root": "10614:803F0E970",
    "terminals": [
      "18902:803F00790"
    ],
    "truncation": {
      "budget_exhausted": false,
      "capped_vertices": 0,
      "degree_cap": 16,
      "edge_budget": 200,
      "reason": null
    }
  },
  "transaction_ids": [
    "TX0004337676"
  ]
}